{"activation_fingerprint":"64dcb94b5adc76969b79c1a4298c7fd2f9eb84a737574d4cd7d730a306733d94","activation_id":"act:inc-osbench-phase3-tactical-v1-foothill_access-seed-4101:tactical","bridge_provenance":{"bridge_kind":"incident_packet_to_tactical_activation","bridge_version":"orbital-shepherd-escalation-bridge/1.0.0","notes":["region_resolution:explicit_bundle","region_bundle:rb:fixture-micro-region:v1"],"source_downlink_time_utc":"2026-08-14T03:41:00Z","source_observation_time_utc":"2026-08-14T03:30:00Z","source_packet_id":"pkt:inc-osbench-phase3-tactical-v1-foothill_access-seed-4101:0001"},"bundle_fingerprint":"373f0124e1f4435619a1596f16885b308f158177c91735b9adcca658f4938591","compilation":{"compiled_at_utc":"2026-04-22T12:00:00Z","compiler_version":"orbital-shepherd-tactical-scenario-engine/1.0.0","source_manifest_id":"tsm:inc-osbench-phase3-tactical-v1-foothill_access-seed-4101:foothill_access:seed-4101","source_manifest_schema_version":"1.0.0","source_manifest_sha256":"8d5d981cc1970ddb6f5b590b6f7dbf2d30001622dc2ebf9aec6aa2a9c3cc1506"},"config":{"benchmark_id":"osbench-phase3-tactical-v1","family_display_name":"Foothill Access","family_parameters":{"recipe_id":"tr:osbench-phase3-tactical-v1:foothill_access:seed-4101"},"max_active_routes":4,"notes":"Initial-attack access into steep foothill terrain with narrow approaches.","overlay_focus":"temporary_penalty","planning_horizon_minutes":240,"region_bundle_fingerprint":"a0e45b432b496628d3752d1e29ba7beb95e7d6e024397ad25a3e2743e81903cb","reroute_on_blockage":true},"decision_interval_seconds":300,"depot_assignments":[{"assignment_role":"engine_alpha","depot_facility_id":"fac:fixture-station-01","queue_order":0,"unit_id":"unit:foothill_access:engine_alpha:seed-4101"},{"assignment_role":"engine_bravo","depot_facility_id":"fac:fixture-station-01","queue_order":1,"unit_id":"unit:foothill_access:engine_bravo:seed-4101"},{"assignment_role":"crew_hill","depot_facility_id":"fac:fixture-station-01","queue_order":2,"unit_id":"unit:foothill_access:crew_hill:seed-4101"},{"assignment_role":"dozer_cut","depot_facility_id":"fac:fixture-staging-01","queue_order":3,"unit_id":"unit:foothill_access:dozer_cut:seed-4101"},{"assignment_role":"command_post","depot_facility_id":"fac:inc-osbench-phase3-tactical-v1-foothill_access-seed-4101:command-post","queue_order":4,"unit_id":"unit:foothill_access:command_post:seed-4101"},{"assignment_role":"heli_lift","depot_facility_id":"fac:inc-osbench-phase3-tactical-v1-foothill_access-seed-4101:helibase","queue_order":5,"unit_id":"unit:foothill_access:heli_lift:seed-4101"}],"dispatch_units":[{"callsign":"FA Engine Alpha","current_facility_id":"fac:fixture-station-01","equipment_capacity":1500.0,"home_facility_id":"fac:fixture-station-01","location":{"alt_m":610.0,"lat":38.7021,"lon":-120.8013},"personnel_count":4,"schema_version":"1.0.0","status":"assigned","travel_mode":"road","unit_id":"unit:foothill_access:engine_alpha:seed-4101","unit_type":"engine"},{"callsign":"FA Engine Bravo","current_facility_id":"fac:fixture-station-01","equipment_capacity":1400.0,"home_facility_id":"fac:fixture-station-01","location":{"alt_m":610.0,"lat":38.7021,"lon":-120.8013},"personnel_count":4,"schema_version":"1.0.0","status":"assigned","travel_mode":"road","unit_id":"unit:foothill_access:engine_bravo:seed-4101","unit_type":"engine"},{"callsign":"FA Crew Hill","current_facility_id":"fac:fixture-station-01","equipment_capacity":320.0,"home_facility_id":"fac:fixture-station-01","location":{"alt_m":610.0,"lat":38.7021,"lon":-120.8013},"personnel_count":6,"schema_version":"1.0.0","status":"assigned","travel_mode":"road","unit_id":"unit:foothill_access:crew_hill:seed-4101","unit_type":"crew"},{"callsign":"FA Dozer Cut","current_facility_id":"fac:fixture-staging-01","equipment_capacity":1.0,"home_facility_id":"fac:fixture-staging-01","location":{"alt_m":636.0,"lat":38.7034,"lon":-120.7958},"personnel_count":2,"schema_version":"1.0.0","status":"assigned","travel_mode":"road","unit_id":"unit:foothill_access:dozer_cut:seed-4101","unit_type":"dozer"},{"callsign":"FA Command Post","current_facility_id":"fac:inc-osbench-phase3-tactical-v1-foothill_access-seed-4101:command-post","equipment_capacity":0.0,"home_facility_id":"fac:inc-osbench-phase3-tactical-v1-foothill_access-seed-4101:command-post","location":{"alt_m":640.0,"lat":38.702423,"lon":-120.801553},"personnel_count":3,"schema_version":"1.0.0","status":"available","travel_mode":"road","unit_id":"unit:foothill_access:command_post:seed-4101","unit_type":"command"},{"callsign":"FA Heli Lift","current_facility_id":"fac:inc-osbench-phase3-tactical-v1-foothill_access-seed-4101:helibase","equipment_capacity":900.0,"home_facility_id":"fac:inc-osbench-phase3-tactical-v1-foothill_access-seed-4101:helibase","location":{"alt_m":710.0,"lat":38.704038,"lon":-120.788848},"personnel_count":5,"schema_version":"1.0.0","status":"available","travel_mode":"air","unit_id":"unit:foothill_access:heli_lift:seed-4101","unit_type":"helicopter"}],"facilities":[{"availability":"nominal","capacity_units":3,"facility_id":"fac:fixture-staging-01","facility_name":"Fixture Staging Area 01","facility_type":"staging_area","location":{"alt_m":636.0,"lat":38.7034,"lon":-120.7958},"schema_version":"1.0.0","supported_unit_types":["engine","crew","dozer","command"]},{"availability":"nominal","capacity_units":2,"facility_id":"fac:fixture-station-01","facility_name":"Fixture Station 01","facility_type":"station","location":{"alt_m":610.0,"lat":38.7021,"lon":-120.8013},"schema_version":"1.0.0","supported_unit_types":["engine","crew","command"]},{"availability":"nominal","capacity_units":4,"facility_id":"fac:inc-osbench-phase3-tactical-v1-foothill_access-seed-4101:command-post","facility_name":"Incident Command Post","facility_type":"command_post","location":{"alt_m":640.0,"lat":38.702423,"lon":-120.801553},"schema_version":"1.0.0","supported_unit_types":["command","engine","crew","helicopter"]},{"availability":"nominal","capacity_units":4,"facility_id":"fac:inc-osbench-phase3-tactical-v1-foothill_access-seed-4101:drop-point","facility_name":"Incident Drop Point","facility_type":"drop_point","location":{"alt_m":670.0,"lat":38.7015,"lon":-120.79175},"schema_version":"1.0.0","supported_unit_types":["engine","crew","dozer","helicopter","air_tanker","command"]},{"availability":"nominal","capacity_units":3,"facility_id":"fac:inc-osbench-phase3-tactical-v1-foothill_access-seed-4101:helibase","facility_name":"Tactical Helibase","facility_type":"helibase","location":{"alt_m":710.0,"lat":38.704038,"lon":-120.788848},"schema_version":"1.0.0","supported_unit_types":["helicopter","air_tanker","command"]}],"incident_context":{"activation_delay_seconds":0,"confidence":0.82,"downstream_value_estimate":0.81,"geometry":{"centroid":{"lat":38.7015,"lon":-120.79175},"estimated_area_ha":85.12,"perimeter_ring":[{"lat":38.703345,"lon":-120.79175},{"lat":38.7015,"lon":-120.789386},{"lat":38.699655,"lon":-120.79175},{"lat":38.7015,"lon":-120.794114},{"lat":38.703345,"lon":-120.79175}]},"incident_id":"inc:osbench-phase3-tactical-v1:foothill_access:seed-4101","recommended_action":"dispatch_ground","severity_class":"very_high","severity_score":0.763,"summary":"Foothill Access packet variant 1 for deterministic tactical compilation.","target_cell_id":"tc:8928308280fffff","urgency_score":0.72},"incident_packet":{"confidence":0.82,"downlink_time_utc":"2026-08-14T03:41:00Z","downstream_value_estimate":0.81,"incident_id":"inc:osbench-phase3-tactical-v1:foothill_access:seed-4101","observation_opportunity_id":"opp:foothill_access:tc-8928308280fffff:seed-4101","observation_time_utc":"2026-08-14T03:30:00Z","packet_id":"pkt:inc-osbench-phase3-tactical-v1-foothill_access-seed-4101:0001","recommended_action":"dispatch_ground","schema_version":"1.0.0","summary":"Foothill Access packet variant 1 for deterministic tactical compilation.","target_cell_id":"tc:8928308280fffff","urgency_score":0.72},"incident_packet_id":"pkt:inc-osbench-phase3-tactical-v1-foothill_access-seed-4101:0001","operational_objectives":["secure a reliable uphill access route","stage engines where water resupply remains viable","keep command reachable if access roads degrade"],"overlay_events":[{"affected_asset_ids":["asset:fixture-school-zone-01","asset:fixture-water-tank-01"],"edge_effects":[{"closed":false,"delay_seconds":35.0,"edge_id":"re:si-fixture-micro-region-roads-v1:1001:seg-1:forward","reason":"temporary_penalty","speed_cap_kph":14.0},{"closed":false,"delay_seconds":35.0,"edge_id":"re:si-fixture-micro-region-roads-v1:1003:seg-0:forward","reason":"temporary_penalty","speed_cap_kph":14.0}],"overlay_event_id":"ovl:foothill_access:foothill-access-grade:4101","overlay_kind":"temporary_penalty","severity_score":0.64,"summary":"Foothill Access temporary penalty degrades travel speed and staging flow.","title":"Foothill Access Grade","window":{"end_time_utc":"2026-08-14T07:42:00Z","start_time_utc":"2026-08-14T03:42:00Z"},"zone_ring":[{"lat":38.703345,"lon":-120.79175},{"lat":38.7015,"lon":-120.789386},{"lat":38.699655,"lon":-120.79175},{"lat":38.7015,"lon":-120.794114},{"lat":38.703345,"lon":-120.79175}]}],"region_bundle_id":"rb:fixture-micro-region:v1","region_selection":{"candidate_region_bundle_ids":["rb:fixture-micro-region:v1"],"matched_h3_cell":"8928308280fffff","region_bundle_fingerprint":"a0e45b432b496628d3752d1e29ba7beb95e7d6e024397ad25a3e2743e81903cb","region_bundle_id":"rb:fixture-micro-region:v1","region_id":"region:fixture-micro-region","region_manifest_id":"rm:fixture-micro-region:v1","resolution_strategy":"explicit_bundle"},"route_plans":[{"destination_facility_id":"fac:inc-osbench-phase3-tactical-v1-foothill_access-seed-4101:drop-point","distance_km":1.266,"estimated_duration_seconds":330,"origin_facility_id":"fac:fixture-station-01","risk_score":0.55505,"road_segment_ids":["re:si-fixture-micro-region-roads-v1:1004:seg-0:reverse","re:si-fixture-micro-region-roads-v1:1001:seg-0:forward","re:si-fixture-micro-region-roa